{
  "$schema": "./schema/athena-graph-1.0.schema.json",
  "format": "Athena AIBOM graph companion",
  "format_version": "1.0",
  "header": {
    "document_id": "athena-r26.1-aibom",
    "revision": 3,
    "system": "Athena R26.1",
    "graph_type": "reference-runtime-system-with-build-and-lineage-context",
    "prepared_on": "2026-09-19",
    "generation_method": "AI-assisted manual analysis of exact source snapshots and primary publisher records, with deterministic hashing and validation",
    "prepared_by": "OpenAI Codex, at Igor Barshteyn's request",
    "responsible_maintainer": "Igor Barshteyn",
    "maintainer_review": "not-recorded",
    "approval": "not-recorded",
    "completeness": "partial",
    "validity": "Current overlay source at the projector-installer update with unchanged tested stock baseline; supplied licensing package 2.0 retains its earlier reviewed source identifiers. Installed artifacts, license adoption and deployment compliance are not attested.",
    "deployment_observation": "none",
    "source_revisions": {
      "overlay": {
        "repository": "https://github.com/igorbarshteyn/athena-consciousness",
        "commit": "b3c6e54ead4976c043cd0fca9452bd07d7e2689c"
      },
      "stock": {
        "repository": "https://github.com/igorbarshteyn/athena",
        "commit": "e747c0362c4e1c3b95756a57154d09b8df7811ce"
      },
      "whisper": {
        "repository": "https://github.com/ggml-org/whisper.cpp",
        "commit": "afa2ea544fb4b0448916b4a31ecd33c8685bd482"
      },
      "llama-origin": {
        "repository": "https://github.com/ggml-org/llama.cpp",
        "commit": "3e037f313c2c4cfce897d9be8f43954283a61de1"
      }
    },
    "scope": {
      "included": "R26.1 overlay, tested stock base, declared reference native runtime, seven model roles, first-level dependencies, mutable data categories, permissions and conditional flows.",
      "excluded": "Actual installed binaries/weights/configuration, private memory/image/log contents, full transitive OS/build closure, supplier training internals, unconfigured alternate models/services, and subjective-consciousness/compliance judgments."
    },
    "views": {
      "declared": "source/configuration and supplier descriptions",
      "reachable": "statically described native actions conditional on config/permissions; not an exhaustive reachability proof",
      "observed": "none"
    },
    "encoding": {
      "inventory": "CycloneDX 1.7",
      "graph": "Athena project companion schema 1.0; not CycloneDX 2.0",
      "reason": "The guide anticipates CycloneDX 2.0 blueprints. Published current specification remains 1.7 as reviewed."
    },
    "updated_on": "2026-09-19",
    "licensing": {
      "file": "license-mapping.json",
      "custom_identifier": "LicenseRef-Athena-NCARD-2.0",
      "package_version": "2.0",
      "adoption_commit": {
        "stock": null,
        "overlay": null
      },
      "status": "supplied-declaration; not-verified-repository-adoption",
      "evidence_refs": [
        "E60",
        "E61",
        "E62",
        "E81",
        "E82"
      ]
    },
    "source_update": {
      "file": "source-update.json",
      "previous_overlay_commit": "f779a98246d4a8cf69c2bbf6e905a1439fefd0f3",
      "current_overlay_commit": "b3c6e54ead4976c043cd0fca9452bd07d7e2689c",
      "native_runtime_source_changed": false
    }
  },
  "nodes": [
    {
      "id": "C-overlay",
      "bom_ref": "C-overlay",
      "name": "Athena consciousness source overlay",
      "zone": "Z-brain",
      "membership": "constituent",
      "role": "runtime",
      "evidence_refs": [
        "E01",
        "E24",
        "E62",
        "E64",
        "E66",
        "E68",
        "E86"
      ],
      "status": "source-declared"
    },
    {
      "id": "C-stock",
      "bom_ref": "C-stock",
      "name": "Stock Athena source",
      "zone": "Z-brain",
      "membership": "constituent",
      "role": "runtime",
      "evidence_refs": [
        "E02",
        "E23",
        "E61",
        "E63",
        "E65",
        "E67"
      ],
      "status": "source-declared"
    },
    {
      "id": "C-brain",
      "bom_ref": "C-brain",
      "name": "whisper-talk-llama (Athena modified)",
      "zone": "Z-brain",
      "membership": "constituent",
      "role": "runtime",
      "evidence_refs": [
        "E07",
        "E04",
        "E62",
        "E64",
        "E66",
        "E68"
      ],
      "status": "source-declared"
    },
    {
      "id": "C-mind",
      "bom_ref": "C-mind",
      "name": "Native consciousness and initiative controller",
      "zone": "Z-brain",
      "membership": "constituent",
      "role": "runtime",
      "evidence_refs": [
        "E08",
        "E14",
        "E15",
        "E16",
        "E62",
        "E64",
        "E66",
        "E68"
      ],
      "status": "source-declared"
    },
    {
      "id": "C-inner",
      "bom_ref": "C-inner",
      "name": "Private reflection and dream worker",
      "zone": "Z-brain",
      "membership": "constituent",
      "role": "runtime",
      "evidence_refs": [
        "E07",
        "E09",
        "E62",
        "E64",
        "E66",
        "E68"
      ],
      "status": "source-declared"
    },
    {
      "id": "C-memory",
      "bom_ref": "C-memory",
      "name": "Source-aware memory and continuity",
      "zone": "Z-brain",
      "membership": "constituent",
      "role": "runtime",
      "evidence_refs": [
        "E10",
        "E17",
        "E19",
        "E62",
        "E64",
        "E66",
        "E68"
      ],
      "status": "source-declared"
    },
    {
      "id": "C-vision",
      "bom_ref": "C-vision",
      "name": "Camera, image recall and retention integration",
      "zone": "Z-brain",
      "membership": "constituent",
      "role": "runtime",
      "evidence_refs": [
        "E11",
        "E18",
        "E62",
        "E64",
        "E66",
        "E68"
      ],
      "status": "source-declared"
    },
    {
      "id": "C-prosody",
      "bom_ref": "C-prosody",
      "name": "Speech delivery and prosody integration",
      "zone": "Z-brain",
      "membership": "constituent",
      "role": "runtime",
      "evidence_refs": [
        "E07",
        "E12",
        "E13",
        "E62",
        "E64",
        "E66",
        "E68"
      ],
      "status": "source-declared"
    },
    {
      "id": "C-speech",
      "bom_ref": "C-speech",
      "name": "orpheus-speak (Athena native application)",
      "zone": "Z-tts",
      "membership": "constituent",
      "role": "runtime",
      "evidence_refs": [
        "E12",
        "E05",
        "E62",
        "E64",
        "E66",
        "E68"
      ],
      "status": "source-declared"
    },
    {
      "id": "C-launch",
      "bom_ref": "C-launch",
      "name": "Reference supervised launcher",
      "zone": "Z-admin",
      "membership": "constituent",
      "role": "runtime",
      "evidence_refs": [
        "E03",
        "E24",
        "E62",
        "E64",
        "E66",
        "E68"
      ],
      "status": "source-declared"
    },
    {
      "id": "C-calibrate",
      "bom_ref": "C-calibrate",
      "name": "athena-emotion-calibrate",
      "zone": "Z-brain",
      "membership": "constituent",
      "role": "runtime",
      "evidence_refs": [
        "E21",
        "E04",
        "E62",
        "E64",
        "E66",
        "E68"
      ],
      "status": "source-declared"
    },
    {
      "id": "C-export",
      "bom_ref": "C-export",
      "name": "emotion2vec ONNX export recipe",
      "zone": "Z-build",
      "membership": "constituent",
      "role": "build-only",
      "evidence_refs": [
        "E06",
        "E02",
        "E61",
        "E63",
        "E65",
        "E67"
      ],
      "status": "source-declared"
    },
    {
      "id": "P-prompts",
      "bom_ref": "P-prompts",
      "name": "Compiled prompt and policy templates",
      "zone": "Z-brain",
      "membership": "constituent",
      "role": "runtime",
      "evidence_refs": [
        "E07",
        "E08",
        "E10",
        "E62",
        "E64",
        "E66",
        "E68"
      ],
      "status": "source-declared"
    },
    {
      "id": "P-config",
      "bom_ref": "P-config",
      "name": "Reference launch and feature configuration",
      "zone": "Z-brain",
      "membership": "constituent",
      "role": "runtime",
      "evidence_refs": [
        "E01",
        "E03",
        "E14",
        "E62",
        "E64",
        "E66",
        "E68"
      ],
      "status": "source-declared"
    },
    {
      "id": "P-wire",
      "bom_ref": "P-wire",
      "name": "Native speech protocol definitions",
      "zone": "Z-brain",
      "membership": "constituent",
      "role": "runtime",
      "evidence_refs": [
        "E13",
        "E62",
        "E64",
        "E66",
        "E68"
      ],
      "status": "source-declared"
    },
    {
      "id": "S-whisper",
      "bom_ref": "S-whisper",
      "name": "whisper.cpp",
      "zone": "Z-brain",
      "membership": "constituent",
      "role": "runtime",
      "evidence_refs": [
        "E02",
        "E04",
        "E27",
        "E71",
        "E72"
      ],
      "status": "source-declared"
    },
    {
      "id": "S-llama-brain",
      "bom_ref": "S-llama-brain",
      "name": "llama.cpp copy inside Whisper talk-llama",
      "zone": "Z-brain",
      "membership": "constituent",
      "role": "runtime",
      "evidence_refs": [
        "E04",
        "E07",
        "E27",
        "E28",
        "E71",
        "E72"
      ],
      "status": "source-declared"
    },
    {
      "id": "S-ggml",
      "bom_ref": "S-ggml",
      "name": "ggml in pinned whisper.cpp",
      "zone": "Z-brain",
      "membership": "constituent",
      "role": "runtime",
      "evidence_refs": [
        "E02",
        "E04",
        "E27",
        "E71",
        "E72"
      ],
      "status": "source-declared"
    },
    {
      "id": "S-mtmd",
      "bom_ref": "S-mtmd",